{
  "$schema": "../../schemas/task.schema.json",
  "id": "00000000-0000-4000-8000-000000000001",
  "headline": "Example: Sync Notion tasks to Supabase",
  "description": "Sample task shape — replace with real tasks at runtime",
  "responsible": "a1111111-1111-4111-8111-111111111111",
  "status": ["queued"],
  "created_at": "2026-01-01T00:00:00.000Z"
}
